{
  "company_name": "NTPC Limited",
  "candidate_id": "renewable_transition_001",
  "hypothesis": "NTPC's aggressive renewable capacity expansion (target 60GW by 2032) represents a pivot that is heavily reliant on subsidiary-led vehicles and strategic joint ventures rather than direct parent-led organic growth.",
  "retrieval_performed": false,
  "research_questions": [
    {
      "question": "To what extent is the 60GW target achieved through dedicated renewable subsidiaries (NGEL) vs. the parent company?",
      "metrics": [
        "MW capacity added by subsidiary",
        "MW capacity added by parent",
        "Equity contribution per vehicle"
      ],
      "periods": [
        "FY2022-2025"
      ],
      "supported_by_dataset": false,
      "missing": [
        "Breakdown of capacity ownership by entity",
        "Capital expenditure allocation per subsidiary"
      ]
    },
    {
      "question": "Does the reliance on NGEL IPO proceeds indicate a shift in the parent's risk-bearing capacity?",
      "metrics": [
        "Debt-to-equity ratio of NGEL",
        "Cost of debt for NGEL vs NTPC parent",
        "IPO proceeds deployment timeline"
      ],
      "periods": [
        "FY2025"
      ],
      "supported_by_dataset": true,
      "missing": [
        "Detailed prospectus and post-IPO utilization report"
      ]
    }
  ],
  "evidence_ledger": [
    {
      "evidence_id": "ev_fed1ce3d68b30da9c8ece744",
      "source_type": "Integrated Annual Report 2024-25",
      "source_url": null,
      "publication_date": null,
      "excerpt_or_data_point": "NTPC Group has commissioned 6.8 GW of renewable energy capacity as of March 31, 2025.",
      "claim_supported": "NTPC RE progress against 60GW goal",
      "kind": "reported_fact",
      "status": "supplied"
    },
    {
      "evidence_id": "ev_d284dd5e0503ac55d73f2441",
      "source_type": "Press Release/IPO Prospectus",
      "source_url": null,
      "publication_date": "2024-11",
      "excerpt_or_data_point": "NGEL raised 10,000 crore through an IPO in November 2024.",
      "claim_supported": "Strategic shift to subsidiary-led capital raising",
      "kind": "reported_fact",
      "status": "supplied"
    }
  ],
  "checklist": [
    {
      "step": "Analyze NTPC and subsidiary balance sheets",
      "expected_evidence": "Consolidated vs Standalone financial statements",
      "cross_validation_sources": [
        "Stock exchange filings",
        "Annual Reports"
      ],
      "calculation": "Ratio of RE assets in subsidiary books vs parent books",
      "completion_criteria": "Quantification of asset distribution"
    },
    {
      "step": "Map capacity growth to vehicle type",
      "expected_evidence": "List of projects linked to NGEL, NREL, THDC, NEEPCO",
      "cross_validation_sources": [
        "Investor Presentations",
        "Ministry of Power disclosures"
      ],
      "calculation": "Sum of RE capacity per entity",
      "completion_criteria": "Reconciliation of total 6.8 GW commissioned capacity"
    }
  ],
  "alternative_explanation": "The transition structure may be driven by tax optimization and regulatory requirements for project-specific special purpose vehicles (SPVs) rather than a strategic shift away from the parent's control or risk profile.",
  "falsification_test": "If NTPC parent company records show direct ownership of 80%+ of new renewable capacity and majority financing provided via direct balance sheet loans (not subsidiary IPOs or JVs) as of 2026/2027."
}
